industry,business name,address,external link,phone number,additional_info,emails,business hours,teaser
Logistics,Seaway Logistics Solutions LLC,"910 Oak Tree Ave Ste H South Plainfield, NJ 07080",,(908) 279-6939,"Business Consultants, Freight Forwarding",[],,
Logistics,Aliport Logistics Wrhse LLC,"635 Ramsey Ave Hillside, NJ 07205",,(908) 624-0160,Freight Forwarding,[],,
Logistics,Summit Logistics International Inc,"800 Federal Blvd Ste 3 Carteret, NJ 07008",,(732) 338-8070,"Business Consultants, Wholesale Toys & Games",[],,
Logistics,Global Transport Logistics INC,"19-05 Nevins Rd Fair Lawn, NJ 07410",,(201) 475-2500,"Trucking Companies, Transportation Services, Business Consultants, Passenger Transportation",[],,
Logistics,Demark Global Logistics Nj,"2301 E Edgar Rd Bldg 3A Linden, NJ 07036",,(908) 486-3520,Freight Forwarding,[],,
Logistics,Garden State Logistics Llc,"630 New County Rd Secaucus, NJ 07094",,(201) 865-2600,Trucking Companies,[],,
Logistics,M A V Logistics,"31 Minnisink Rd Wayne, NJ 07470",,(973) 837-1910,Trucking Companies,[],,
Logistics,J & R Logistics Group,"720 S Front St Elizabeth, NJ 07202",,(908) 469-4557,"Freight Forwarding, Wholesalers",[],,
Logistics,J W Logistics LLC,"2 Brighton Ave Passaic, NJ 07055",,(973) 777-5657,Business Consultants,[],,
Logistics,Global Logistics Nj LLC,"275 Veterans Blvd Rutherford, NJ 07070",,(201) 935-2221,Freight Forwarding,[],,
Logistics,Load Pro Logistics LLC,"1125 E Park Ave Vineland, NJ 08360",,(856) 839-4816,Business Consultants,[],,
Logistics,A & A Logistics Inc,"460 Coit St Bldg D Irvington, NJ 07111",,(973) 416-7500,Transportation Services,[],,
Logistics,Xpo Logistics Last Mile,"201 Bay Ave Elizabeth, NJ 07201",,(866) 373-7917,Unclassified,[],,
Logistics,Fortuna Global Logistics LLC,"50 Cragwood Rd Ste 227 South Plainfield, NJ 07080",,(908) 941-1524,Business Consultants,[],,
Logistics,Omni Logistics - Philadelphia Gateway,"970 Harding Hwy Ste 200 Carneys Point, NJ 08069",,(856) 579-7710,,[],,
Logistics,A L G Worldwide Logistics,"340 S Stiles St Linden, NJ 07036",,(908) 583-5947,"Business Consultants, Truck Repair",[],,
Logistics,SOL AND CARTER LOGISTICS LLC,"323 Stanley Ave Bayonne, NJ 07002",,(201) 246-3544,Agriculture & Forestry,[],,
Logistics,B N S F Logistics,"900 US Highway 9 N Ste 403 Woodbridge, NJ 07095",,(732) 634-3213,"Trucking Companies, Transportation Services, Freight Forwarding, Business Consultants",[],,
Logistics,Lotte Global Logistics USA Inc,"29 Smith St Englewood, NJ 07631",,(201) 567-1385,Business Consultants,[],,
Logistics,F R W D Logistics,"28 Bloomfield Ave Pine Brook, NJ 07058",,(973) 227-4272,"Transportation Services, Freight Forwarding",[],,
Logistics,AIT Worldwide Logistics - Final Mile,"60 Metro Way Ste 1 Secaucus, NJ 07094",,(866) 939-7737,,[],,
Logistics,D Z Y X 1 M Logistics,"1100 Milik St Carteret, NJ 07008",,(732) 802-2005,Business Consultants,[],,
Logistics,R Z Y X 1 S Logistics LLC,"69 Lefante Dr Bayonne, NJ 07002",,(201) 823-2078,"Business Consultants, Trucking Companies",[],,
Automotive,Neil's Automotive,"125 Railroad Ave Ridgefield Park, NJ 07660",,(201) 440-2625,"Auto Body Paint & Repair, Automotive Repair",[],Business Hours: Mon. - Fri. 9am - 5pm;Sat. - Sun. CLOSED,
Automotive,Reyco Automotive,"25 Bergen Blvd Fairview, NJ 07022",,(201) 840-9787,"Auto Diagnostics, Muffler Repair, Clutch Repair, Truck Repair, Brake Repair, Radiator Repair, Automotive Repair, Auto Inspections, Oil Changes, Tune Ups, Engine Repair",[],"Business Hours: Monday 07:30 - 06:00, Tuesday 07:30 - 06:00, Wednesday 07:30 - 06:00, Thursday, 07:30 - 06:00, Friday 07:30 - 08:00, Saturday CLOSE - CLOSE, Sunday CLOSE - CLOSE",
Automotive,Huber's Automotive,"1 Hamburg Tpke Riverdale, NJ 07457",,(973) 839-3169,"Cooper Tire, Heating & Air Conditioning, BF Goodrich, Brake Repair, Radiator Repair, Dodge, Tune Ups, Auto Inspections, Discover Accepted, Continental, Automotive Sales & Services, Used Car Dealers, Clutch Repair, Dunlop Tire, Cadillac, Chrysler-Plymouth, American Express Accepted, Transmission Repair, Antique & Classic Car Restoration, Volvo, Engine Repair, Auto Restoration, Armstrong, Convenience Stores, Muffler Repair, Auto Parts & Accessories, Smog Testing, Automotive Repair, Chevrolet, Gas Stations, Acura, Audi, Yokohama, Buick, Mastercard Accepted, Toyo, Truck Repair, Computer Repair, Tires & Wheels, Visa Accepted, Tires, Oil Changes, BMW",[],Business Hours: M-F 8:00am - 5:00pm,
Automotive,Corbo's Automotive,"40 S Gaston Ave Somerville, NJ 08876",,(908) 725-8834,"Oil Changes, American Express Accepted, Gas Stations, Towing & Wrecking, Towing, Antique & Classic Car Restoration, Wholesale Automotive, Auto Inspections, Auto Parts & Accessories, Automotive Repair, Brake Repair, Discover Accepted, Manufacturers, Auto Restoration, Marine Service Station, Visa Accepted, Wholesale Auto Parts, Mastercard Accepted",[],"Business Hours: Mon-Thu 8am-8pm, Fri 8am-6pm, Sat 8am-1pm",
Automotive,Automotive Excellence,"603 Memorial Dr Asbury Park, NJ 07712",,(732) 749-3505,"Auto Body Paint & Repair, Automotive Repair, Wholesale Automotive",[],,
Automotive,Dave's Automotive,"27 Bordentown Ave Old Bridge, NJ 08857",,(732) 254-7666,"Brake Repair, Automotive Repair, Auto Body Paint & Repair, Auto Inspections",[],,
Automotive,Automotive Solutions,"81 Shreve St Mount Holly, NJ 08060",,(609) 267-7070,"Automotive Repair, Auto Body Paint & Repair, Engine Repair, Auto Repair Manuals, Brake Repair, Oil Changes, Auto Parts & Accessories, Manufacturers, Wholesale Automotive",[],"Business Hours: Mon-Fri 8am-6pm, Sat 9am-3pm",
Automotive,Olson's Automotive,"847 Atlantic City Blvd Bayville, NJ 08721",,(732) 269-6000,"Towing & Wrecking, Auto Body Paint & Repair, Automotive Repair",[],,
Automotive,Superior Automotive,"1137 US Highway 130 Trenton, NJ 08691",,(609) 208-0111,"American Express Accepted, Brake Repair, Auto Inspections, Machine Shops, Continental, Muffler Repair, Michelin, Auto Parts & Accessories, Automotive Repair, General Tire, Yokohama, Visa Accepted, Mastercard Accepted, Toyo, Discover Accepted, Mufflers & Exhaust Manufacturers, Engine Repair, Goodyear, Tires",[],Business Hours: Mon 08:00 AM-06:00 PM;Tue 08:00 AM-06:00 PM;Wed 08:00 AM-06:00 PM;Thu 08:00 AM-06:00 PM;Fri 08:00 AM-06:00 PM;Sat 08:00 AM-02:00 PM,
Automotive,Legacy Automotive,"2086 Route 88 Brick, NJ 08724",,(732) 920-1060,"Auto Diagnostics, Auto Parts & Accessories, Towing & Wrecking, Manufacturers, Automotive Repair, Oil Changes",[],"Business Hours: Mon-Fri 8am-5pm, Sat 8am-1pm",
Automotive,Mikes Automotive,"1121 Main St Boonton, NJ 07005",,(973) 334-6620,"Towing & Wrecking, Automotive Repair",[],,
Automotive,Hytek Automotive,"274 Rick Rd Milford, NJ 08848",,(908) 310-3906,Automotive Repair,[],,
Automotive,Dva Automotive,"65 Central Ave East Orange, NJ 07018",,(973) 673-8253,Automotive Repair,[],,
Automotive,Roberts' Automotive,"237 Stokes Ave Ewing, NJ 08638",,(609) 883-6710,Automotive Repair,[],,
Automotive,MTB Automotive,"246 Fries Mill Rd Turnersville, NJ 08012",,(856) 516-4941,Automotive Repair,[],,
Automotive,Anthony's Automotive,"279 E Main St Denville, NJ 07834",,(973) 887-0150,"Automotive Repair, American Express Accepted, Mastercard Accepted, Debit Card Accepted, Alternative Fuels, Discover Accepted, Gas Stations, Shell, Visa Accepted",[],Business Hours: Daily 8am-5pm,
Automotive,Starling Automotive,"249 Outwater Ln Garfield, NJ 07026",,(973) 340-9711,Automotive Repair,[],,
Automotive,Chariot Automotive,"797 N Main Rd Vineland, NJ 08360",,(856) 213-5464,"Used Car Dealers, Automotive Repair",[],,
Automotive,Fairview Automotive,"208 Fairview Ave Westwood, NJ 07675",,(201) 722-2934,Automotive Repair,[],,
Automotive,Ken's Automotive,"1076 Old York Rd Ringoes, NJ 08551",,(908) 806-7725,Automotive Repair,[],"Business Hours: Mon-Fri 8am-6pm, Sat 8am-3pm",
Automotive,Braun's Automotive,"2 Lackawanna Pl Morristown, NJ 07960",,(973) 538-3700,Automotive Repair,[],Business Hours: 8am-5pm (Monday through Friday) Closed (Saturday and Sunday,
Automotive,German Automotive,"872 Shrewsbury Ave Tinton Falls, NJ 07724",,(732) 544-0441,"Muffler Repair, BMW, Tune Ups, Audi, Brake Repair, Mercedes-Benz, Automotive Repair, Radiator Repair, Auto Parts & Accessories, Auto Diagnostics, Clutch Repair, Tires & Wheels, Volkswagen, Transmission Repair, Auto Restoration, Engine Repair",[],"Business Hours: Mon - Fri 8:30 am - 5:00 pm, Sat - Sun Closed",
Automotive,Automotive Degree,"75 Old South Ave W Fanwood, NJ 07023",,(908) 233-1911,"Automotive Repair, Auto Parts & Accessories",[],,
Automotive,Expert Automotive,"502 Main St Fort Lee, NJ 07024",,(201) 461-4495,"Engine Repair, Automotive Repair, General Merchandise Stores",[],,
Automotive,Rj's Automotive,"532 New Freedom Rd Berlin, NJ 08009",,(856) 767-8081,Automotive Repair,[],,
Automotive,Carr's Automotive,"180 County Road 627 Phillipsburg, NJ 08865",,(908) 995-0040,Automotive Repair,[],,
Automotive,Earhart Automotive,"75 Broad St Freehold, NJ 07728",https://apis.elocal.com/tracker/track?q=2264c22d4957f237333f0b7061c8c4c651be88acfb9bd7ed0533e04f4d806b1f91ce9e01e556bd1f9b3630e8ed233682a0c32547bf6349e81bc4a09f1f1ff96a9d067e0c0b7475646885061fd46584abf604963df6f7493da6217161ad7c4720605a1a95bbeb91ee605fdd0bfb5427b6fddd6b00403222a94102324ee54aeed54b6611eab8d93575fa17e6b2b2fc830d3f350acde28ce470bd0dc3860770fe298750a9f8909d5203ff3e04916eff90a8650b7ff63f79242e2c9d24ac20ee474f0841ed49f79f0f4dd3d526425f6ede2946de4de43e28bee685067738603ce24aa87c03186ec35c2a783467f661ef237d6bb905e6bcaf0eb38aa066483330f156b8489cdc91a1f0af0380b61b8902466a3213013e38cbd803559cf75400594a8c3bb091dc57cbe4410f3063ac04f5adc823c2d98970c4356064ee8b2859665b23df7ac806830d6a6efa2cada039a28dbfa6fdc4b6a310908c98dc1a21cce8f739f5504caa770df18abd0b45bf644e802877f730ff64e145a5456563835de488263e774f633efd4dd601671d7804b543b82419ececd3a550091fe682fb9302d1b125cc632548cd9194f82cf4b63d85a20d9bfdade71a069008c0e0105b2f55714569a5e288aa9543e4018e441b04694556ed421a599437b69d53c1192926496a8776e928bb99b10cd02bfa6be723a2e924c762bbd0f82e432a6a115dcfa4e93b19b4c015303f2f9d428b9b99ef1c232620be8143b13a0cca7b3e40f1edda5d1e5f285e4d3ce3a5151928f976f4d3b842c7f813f48d3a0a8f9b1b1b473d82880161a02cfbb1a063529183a0a68955bfd971df7e8d5750e2c8e4b8ddfd4ac26047ea2097969638c178c1424c98e0763b24e3df150b32aacdf67b70f4f558a80e2cdf2bd9e8bd7e7fff95c50329cb9f12540a213a8b9e38fbcd7a12928ca2227a419cd255e2d8913d57646104aa58f4e26b71ab0e9bccf9d96596b8bec019185021c9,(848) 863-8605,"Find ACDelco auto parts for your vehicle at Earhart Automotive in Freehold, NJ. Earhart Automotive provides high-quality car parts for all major vehicle systems, as well as off-road, marine and industrial equipment. Our product portfolio includes maintenance parts, such as car batteries, spark plugs, oil filters, air filters, wiper blades, and brakes, as well as repair parts such as alternators, radiators, chassis and heating/cooling components.",[],,
Automotive,Nick's Automotive,"3612 State Route 27 Kendall Park, NJ 08824",,(732) 798-6135,Automotive Repair,[],,
Automotive,Professional Automotive,"883 Jarvis Rd Sicklerville, NJ 08081",,(856) 309-8502,Automotive Repair,[],,
Automotive,Automotive Magic,"34 Berkshire Valley Rd Kenvil, NJ 07847",,(973) 366-3777,"Service Centers, Automotive Repair, Truck Rentals, Auto Leasing",[],Business Hours: Mon-Fri 8am-5pm,
Automotive,Carma Automotive,"110 W Main St Bound Brook, NJ 08805",,(908) 963-6711,Automotive Repair,[],"Business Hours: Sun 12am-3am, Mon-Fri 9am-7pm, Sat 9am-11:55pm",
Automotive,Pct Automotive,"475 State Rt 23 Pompton Plns, NJ 07444",,(973) 628-0678,Automotive Repair,[],,
Automotive,Prostock Automotive,"330 N Midland Ave Saddle Brook, NJ 07663",,(201) 796-7000,"Hyundai, Volkswagen, Automotive Repair, Nissan, Employment Agencies, Wholesale Auto Parts, Honda, Lexus, Toyota, Land Rover / Range Rover, Mitsubishi, Mercedes-Benz, Audi, BMW, Kia, Suzuki, Tires & Wheels, Hummer, Mazda, Auto Parts & Accessories, Volvo, Car Batteries, Infiniti, Saab, Chrysler-Plymouth, Chevrolet, Auto Part Manufacturers, Acura, Ford, Subaru, Automotive Sales & Services, Jaguar, Cadillac, Jeep, Dodge",[],Business Hours: Mon-Fri: 7:30am-6:00pm; Sat: 8:00am-3:00pm; Sun: 9:00am-2:00pm,
Automotive,Patrick's Automotive,"112 Allerton Rd Annandale, NJ 08801",,(908) 713-1388,Automotive Repair,[],,
Automotive,Precision Automotive,"164 W Clinton St Dover, NJ 07801",,(973) 361-7588,Automotive Repair,[],,
Automotive,Euro Automotive,"3 Schraalenburgh Rd Haworth, NJ 07641",,(201) 374-2713,Automotive Repair,[],,
Automotive,Pasco Automotive,"140 Ethel Rd W Piscataway, NJ 08854",,(732) 339-0600,Automotive Repair,[],,
Automotive,Sos Automotive,"155 Foothill Rd Bound Brook, NJ 08805",,(732) 356-8663,Automotive Repair,[],,
Automotive,John's Automotive,"1842 Route 9 Toms River, NJ 08755",,(732) 228-7647,Automotive Repair,[],,
Automotive,Hahn Automotive,"1306 Roller Rd Ocean, NJ 07712",,(732) 493-4012,"Auto Part Manufacturers, Automotive Repair, Wholesale Auto Parts, Wholesale Distribution Centers",[],,
Automotive,BSE Automotive,"218 W Elizabeth Ave Linden, NJ 07036",,(908) 862-9071,"Automotive Repair, Visa Accepted, Auto Parts & Accessories, Mastercard Accepted",[],"Business Hours: 9AM - 4:30PM, Mon - Fri",
Automotive,Wr Automotive,"603 Washington Ave South Amboy, NJ 08879",,(732) 952-5455,"Tires & Wheels, Automotive Repair",[],,
Automotive,Allied Automotive,"302 Broadway Elmwood Park, NJ 07407",,(201) 797-5840,Automotive Repair,[],,
Automotive,American Automotive,"85 5th Ave Paterson, NJ 07524",,(973) 553-1303,Automotive Repair,[],,
Automotive,Richs Automotive,"42 N Beverwyck Rd Lake Hiawatha, NJ 07034",,(973) 299-2900,"Automotive Repair, Gas Stations",[],,
Automotive,Foggy's Automotive,"1536 Ratzer Rd Wayne, NJ 07470",,(973) 904-3322,"Oil Changes, Radiator Repair, Transmission Repair, Automotive Repair",[],,
Automotive,Ewing Automotive,"821 Ewing Ave Lyndhurst, NJ 07071",,(201) 896-8637,Automotive Repair,[],,
Automotive,Scotty's Automotive,"406 US Highway 206 Montague, NJ 07827",,(973) 293-8665,"Muffler Repair, Toyo, Continental, Yokohama, Diesel Fuel, Radiator Repair, Truck Repair, Auto Parts & Accessories, Automotive Sales & Services, Tune Ups, Oil Changes, Clutch Repair, Smog Testing, Tires, Tires & Wheels, Brake Repair, Used Car Dealers",[],"Business Hours: Mon-Fri 8:00 AM-5:00 PM,Sat-Sun Closed",
Automotive,Sebring Automotive,"15 Staten Trl Hopatcong, NJ 07843",,(973) 663-1631,Automotive Repair,[],,
Automotive,Warnock Automotive,"175 State Route 10 East Hanover, NJ 07936",,(973) 884-2100,"Flex, Jeep, Expedition, Challenger, Discover Accepted, Automotive Repair, Dart, Used Car Dealers, Journey, Charger, Escape, 200, Town & Country, Taurus, Fiesta, Focus, Viper, Wrangler, 300, Patriot, Compass, Mastercard Accepted, Chrysler-Plymouth, Nitro, Dodge, Visa Accepted, Edge, Liberty, Crown Victoria, Mustang, Caliber, Cherokee, Grand Cherokee, Grand Caravan, Durango, Government Contractors, Fusion, Ford, New Car Dealers, Avenger, Explorer",[],Business Hours: Mon. - Fri. 9am - 5pm;Sat. - Sun. CLOSED,
Automotive,International Automotive,"6 Mulberry Ln Mt Arlington, NJ 07856",,(973) 398-2774,"Automotive Repair, Professional Organizations, Auto Parts & Accessories",[],,
Automotive,Chimney Rock Automotive,"783 E Main St Ste B Bridgewater, NJ 08807",,(732) 302-1965,"Mastercard Accepted, Brake Repair, Manufacturers, Continental, Yokohama, Auto Diagnostics, Tires, Auto Inspections, Visa Accepted, Radiator Repair, Mufflers & Exhaust Manufacturers, Clutch Repair, Truck Repair, Oil Changes, Automotive Repair, Toyo, Muffler Repair, Tune Ups, Auto Parts & Accessories",[],Business Hours: Mon-Fri 8am-5:30pm,
Automotive,Decicco Automotive Ctr,"290 River Rd North Arlington, NJ 07031",,(201) 991-0111,"Custom Car Dealers, Auto Body Paint & Repair, Automotive Repair",[],,
Automotive,Hamilton Automotive Inc,"1753 Chambers St Trenton, NJ 08610",,(609) 695-3063,"Visa Accepted, Oil Changes, American Express Accepted, Auto Parts & Accessories, Automotive Repair, Auto Diagnostics, Discover Accepted, Mastercard Accepted, Auto Inspections",[],Business Hours: Mon-Fri 8am-5pm,
Automotive,Supreme Automotive Services,"50 North Ave Garwood, NJ 07027",,(908) 789-0123,"Automotive Repair, Auto Body Paint & Repair, Mastercard Accepted, Visa Accepted",[],"Business Hours: Mon - Fri, 8:30am - 5pm; Sat, Sun, closed",
Automotive,Highland Park Automotive,"1150 Raritan Ave Highland Park, NJ 08904",,(732) 985-1451,"Clutch Repair, Volvo, Firestone, Nissan, Auto Restoration, Tires, Engine Repair, Honda, Ford, Muffler Repair, Oil Changes, Volkswagen, RV Repair, Jeep, Transmission Repair, Chrysler-Plymouth, Tires & Wheels, Auto Diagnostics, Lexus, BMW, Truck Repair, Hyundai, Mercedes-Benz, Auto Inspections, Acura, Toyota, Audi, Dodge, Mazda, Yokohama, GMC, Toyo, Motorcycle Repair, Goodyear, Radiator Repair, Antique & Classic Car Restoration, Brake Repair, Auto Parts & Accessories, Chevrolet, Automotive Repair, Service Centers, Tune Ups, Kia, Continental",[],Business Hours: Mon-Fri 8am-5pm,
Automotive,Barry's Automotive Llc,"350 Main St Sayreville, NJ 08872",,(732) 257-6677,"Auto Body Paint & Repair, Automotive Repair",[],,
Automotive,Walko Automotive Service,"2122 W Camplain Rd Hillsborough, NJ 08844",https://apis.elocal.com/tracker/track?q=a7146b2e68fd8fdb92b0f6ee09c2c334385cd6074e2bbe4d7a5ee55a2d15e3e88ae72b9dd3260cb0015703ffaa26db3fd68fe91b82800da6c8e46e10736062255137a0e5fe3eaf5446d47c20a479eaa5ceaa7b84a91e12b4de7d23bf74265fb88efc5444edc7ed53408608a2a3a5ffe4d811bad372bdff05d7ac45694331ac9eb1abc89ff4f62b4a26f537903317b4c740686ffb40bed8239b0384238d17d3d590f0f72160b5174b5a7a672cbc8fb8e146491af5183c3dcc23f4a50931e5cadea5cb731fb4be3d080c1702a54764f056f3764d94ad37724ccd840c5fed88ab647d8e34bada2de23aeda87eaa326c24930b7efcce9c5b9077501164a94abf2a0991497cbe35fb097036e98eb4f46907b7f6c797a87d20509da1255c109ebad127fe26710009a5462dbb0de5d52f19bbcfca471f87568843a58c07ffbdda95f65e07714db9f3727bc047530cc0e35a16a18d2b0b11854d56290fe2e8d6100f4f769dc690a81bbf34c1458f274b1044a49d7835e6e607a47915036edc3156a7ccfafa1f7ff2546052b1def05258a8579fa70298bfdb6fc92264b01f7b2371e2901918fea2e363badc1b9eaac1ad2cafb9dd1f0b9bf8b786263dc8cd127ee7d3e5aa734136f23e8e92922d0ca73fde1177d48b0b7903498daf7d0b546f11be88bf7698ae651fe61975253e3660c8904a4182ac6d0a63748d11547f86523ffd0f6899f70123f753c45852e585ad24738c827af841703149c20aad8523430f49bc1ba65e24e41ca47c9eb1f086e854578e5a997e04b1bbd6023dfd00c3c4431806136f3a095aab22c8111ecff99d08c3ef5deabdd386a6418ee27c1a78a16dfd7b70d1e813bac9c5fbea216a953d54242a8bd4a6dc1e6527bea350598cbdf8ea7242e2771b069bd79f213ead6408d6c902f82fce4be63dd8b832ef0b6249caf8e9bdcd760f2d7e1fb80a43441b8f4e12307561fa107df496e88bcb3207e3d161d41dfd,(908) 552-0514,"At Walko Automotive, we have been providing the community with value in domestic and Japanese auto service. We accomplish this by keeping our technicians trained and using the latest diagnostic equipment. We promise never to sell anything you don't need or charge for anything you did not get.


Our reputation and long history speak for themselves. We are confident that we can fulfill all of your automotive needs. Our range of services covers all types of auto repair and maintenance and we always offer our clients prompt professional and friendly service.",[],,
Automotive,Forest Automotive Inc,"1422 Union Valley Rd West Milford, NJ 07480",,(973) 728-8074,"Towing, Auto Body Paint & Repair, Towing & Wrecking, Automotive Repair",[],Business Hours: Fri 9am-5pm,
Automotive,Joe Guarino Automotive,"45 Plauderville Ave Garfield, NJ 07026",,(973) 772-8736,"Clutch Repair, Auto Diagnostics, Automotive Repair, Radiator Repair, Muffler Repair, Oil Changes, Truck Repair, Brake Repair, Tune Ups, Auto Inspections",[],"Business Hours: Monday 07:30 - 05:30, Tuesday 07:30 - 05:30, Wednesday 07:30 - 05:30, Thursday, 07:30 - 05:30, Friday 07:30 - 05:30, Saturday CLOSE - CLOSE, Sunday CLOSE - CLOSE",
Automotive,Akar II Automotive,"2 Palmer Rd Middletown, NJ 07748",,(732) 495-3558,"Mastercard Accepted, Continental, Truck Repair, Visa Accepted, Gas Stations, ATM, Auto Parts & Accessories, Yokohama, Automotive Repair, American Express Accepted, Tires, Car Batteries, Exxon/Mobil, Discover Accepted, Tires & Wheels, Toyo, Auto Body Paint & Repair",[],,
Automotive,"Total Automotive, Inc.","41 Orlando Dr Raritan, NJ 08869",,(908) 450-7320,"Towing, Radiator Repair, Auto Body Paint & Repair, Muffler Repair, Brake Repair, Clutch Repair, Oil Changes, Tune Ups, Transmission Repair, Transmission Manufacturers, Engine Repair, Auto Diagnostics, Auto Inspections, Automotive Repair",[],Business Hours: Mon-Fri 8am-6pm; Thurs 8am-8pm; Sat 8am-2pm; Sun Closed; 24 Hour Emergency Available!,
Automotive,Keystone Automotive Industries,"1005 Sherman Ave Pennsauken, NJ 08110",,(856) 665-4780,"Wholesale Importers, Manufacturers, Auto Part Manufacturers, Wholesale Auto Parts, Visa Accepted, Auto Parts & Accessories, Wholesale Used Auto Parts, Automotive Repair, Wholesalers, Plating, Mastercard Accepted",[],,
Automotive,Conte Brothers Automotive,"1415 Brace Rd Cherry Hill, NJ 08034",,(856) 428-4440,"Smog Testing, Wholesale Tires, Automotive Repair, Auto Rentals, Brake Repair, Oil Changes, Toyo, Auto Diagnostics, New Car Dealers, Transmission Manufacturers, Auto Parts & Accessories, Continental, Tires, Repair Shops, Mastercard Accepted, Visa Accepted, Yokohama, Discover Accepted, Transmission Repair, Used Car Dealers",[],"Business Hours: Mon-Fri 7:30am-7pm, Sat 8am-1pm",
Automotive,GC Automotive & Performance,"2 John St Jamesburg, NJ 08831",,(732) 605-1222,"Oil Changes, Auto Parts & Accessories, Manufacturers, Brake Repair, Automotive Repair, Auto Diagnostics",[],"Business Hours: Mon-Fri 8am-6pm, Sat 8am-2pm",
Automotive,Silvestro Automotive Inc,"3045 State Route 10 Denville, NJ 07834",,(973) 361-6640,Automotive Repair,[],,
Automotive,Mac Automotive Svc,"7 S Willow St Montclair, NJ 07042",,(973) 746-9331,Automotive Repair,[],"Business Hours: Mon-Fri 7:30am-5pm, Sat 8am-1pm",
Automotive,Holman Automotive Group,"1200 Route 73 Mount Laurel, NJ 08054",,(856) 840-1412,Automotive Repair,[],"Business Hours: Mon-Thu 9am-8pm, Fri 9am-6pm, Sat 9am-5pm",
Automotive,Scott Tire & Automotive,"207 Trimble Ave Clifton, NJ 07011",,(973) 772-3626,"Tune Ups, Brake Repair, Auto Parts & Accessories, Truck Repair, Continental, Heating & Air Conditioning, Computer Repair, Diesel Fuel, Yokohama, Tires & Wheels, Muffler Repair, Repair Shops, Automotive Sales & Services, Smog Testing, Oil Changes, Radiator Repair, Tire Manufacturers, Toyo, Clutch Repair, American Express Accepted, Automotive Repair, Discover Accepted, Tires, Visa Accepted, Mastercard Accepted, Wholesale Tires",[],"Business Hours: Mon-Thu 7:30am-6pm, Fri 7:30am-5pm, Sat 7:30am-3pm",
Automotive,Danny's Automotive Connection,"163 Port Reading Ave Port Reading, NJ 07064",,(732) 636-9642,"Automotive Repair, Auto Parts & Accessories",[],,
Automotive,Roxbury Automotive INC,"571 US Highway 46 Kenvil, NJ 07847",,(973) 584-5114,"Discover Accepted, Mastercard Accepted, Automotive Repair, Visa Accepted, Auto Diagnostics, American Express Accepted",[],"Business Hours: Mon-Fri 8am-5pm, Sat 8am-12am",
Automotive,Precision Automotive Repair,"717 Saint George Ave Roselle, NJ 07203",,(908) 245-5611,Automotive Repair,[],,
Automotive,Point Beach Automotive,"218 Broadway Point Pleasant Beach, NJ 08742",,(732) 899-5111,"Brake Repair, Automotive Repair",[],,
Automotive,Shore Automotive SVC,"601 Richmond Ave Point Pleasant Beach, NJ 08742",,(732) 295-6690,Automotive Repair,[],,
Automotive,Laneve Automotive LLC,"124 Hamburg Tpke Bloomingdale, NJ 07403",,(973) 838-4494,"Discover Accepted, Gas Stations, Automotive Repair, Mastercard Accepted, Brake Repair, American Express Accepted, Marine Service Station, Visa Accepted",[],"Business Hours: Mon-Fri 7am-5:30pm, Sat 7am-12am",
Automotive,Express Automotive Inc,"188 Main St Metuchen, NJ 08840",,(732) 494-1666,"Automotive Repair, Towing & Wrecking, Towing",[],Business Hours: Daily 24 Hours,
Automotive,Old Time Automotive,"730 US Highway 9 Lanoka Harbor, NJ 08734",,(609) 242-1146,"Automotive Repair, Visa Accepted, Engine Repair, Oil Changes, Transmission Repair, Continental, Tires, Brake Fluid Manufacturers, Muffler Repair, Auto Parts & Accessories, Auto Diagnostics, Smog Testing, Toyo, Mastercard Accepted, Yokohama",[],"Business Hours: Mon-Fri 7:30am-5:30pm, Sat 7:30am-5pm",
Automotive,Reilly's Automotive Repair,"1890 Woodbridge Ave Edison, NJ 08817",,(732) 985-6204,Automotive Repair,[],,
Automotive,H P Automotive,"191 Bergen Tpke Ridgefield Park, NJ 07660",,(201) 814-0123,"Brake Repair, Automotive Repair",[],,
Automotive,A-Tec Automotive,"3541 US Highway 9 Freehold, NJ 07728",,(973) 558-8446,Automotive Repair,[],,
Automotive,J & M Automotive,"1296 Highway 33 Hamilton Square, NJ 08690",,(609) 890-2646,"Gas Stations, Auto Parts & Accessories, American Express Accepted, Automotive Repair, New Car Dealers, Discover Accepted, Visa Accepted, Used Car Dealers, Mastercard Accepted",[],,
Automotive,Wiseman Automotive LLC,"726 Myrtle Ave Boonton, NJ 07005",,(973) 402-4651,Automotive Repair,[],,
Automotive,Tribeca Automotive Inc,"501 New County Rd Secaucus, NJ 07094",,(201) 223-9044,"Motor Freight Trucking, Trucking Companies, Automotive Repair",[],,
Automotive,Park St Automotive,"18 Park St Montclair, NJ 07042",,(973) 509-8888,"Automotive Repair, Wholesale Automotive",[],"Business Hours: Tue - Sat, 7am - 5pm; Sun, closed",
Automotive,Marty's Automotive & Marine,"3201 Bayshore Ave Unit C Brigantine, NJ 08203",,(609) 266-1224,"Automotive Repair, Auto Parts & Accessories",[],,
Automotive,Grm Automotive SVC,"81 State Rt 94 Vernon, NJ 07462",,(973) 209-9281,Automotive Repair,[],,
Automotive,Simpson Automotive & Diesel,"785 Defalco Ave Vineland, NJ 08360",,(856) 212-3433,Automotive Repair,[],,
Automotive,Buxbaum Brothers Automotive,"179 Railroad Ave Ridgefield Park, NJ 07660",,(201) 440-0937,"Auto Parts & Accessories, Automotive Repair, Race Car Dealers",[],,
