industry,business name,address,external link,phone number,additional_info,emails,business hours,teaser
Retail,Bori Cuba Inc,"520 S Clinton Ave Trenton, NJ 08611",,(609) 278-9831,"Musical Instruments, Music CDs & Tapes, Recreation Centers, Shopping, Wholesale Music",[],,
Retail,Pier 1 Imports,"39 Reaville Ave Flemington, NJ 08822",,(908) 806-7437,"Pottery, Visa Accepted, Shopping, Candles, Vanities, Discover Accepted, Holiday Supplies, Chinaware & Glassware, Pier 1 Imports, Ceramics Supplies, Christmas Decorations, Furniture, Gift Shops, Department Stores, Discount Stores, Variety Stores, Home Decor, American Express Accepted, Mastercard Accepted, Stationery Stores, Baskets",[],"Business Hours: Sun 11:00AM - 07:00PM, Mon 10:00AM - 09:00PM, Tue 10:00AM - 09:00PM, Wed 10:00AM - 09:00PM, Thu 10:00AM - 09:00PM, Fri 10:00AM - 09:00PM, Sat 10:00AM - 09:00PM",
Retail,Pier 1 Imports,"2410 Highway 35 Manasquan, NJ 08736",,(732) 528-3124,"Christmas Decorations, Shopping, Baskets, Discount Stores, Pottery, Visa Accepted, Vanities, Candles, Mastercard Accepted, Furniture, Variety Stores, Holiday Supplies, Pier 1 Imports, Gift Shops, Department Stores, Ceramics Supplies, American Express Accepted, Home Decor, Discover Accepted",[],"Business Hours: Sun 11:00AM - 07:00PM, Mon 10:00AM - 09:00PM, Tue 10:00AM - 09:00PM, Wed 10:00AM - 09:00PM, Thu 10:00AM - 09:00PM, Fri 10:00AM - 09:00PM, Sat 10:00AM - 09:00PM",
Retail,Sam Ash Music Stores,"155 US Highway 22 Springfield, NJ 07081",,(973) 376-5161,"Government Contractors, Musical Instruments, Music CDs & Tapes, Used Musical Instruments, Musical Instrument Repair, Shopping",[],"Business Hours: Sun 11am-6pm, Mon-Fri 10am-9pm, Sat 10am-8pm",
Retail,Geniusdesigns.com,"404 Birchfield Dr Mount Laurel, NJ 08054",,(856) 840-0788,"DVDs, Scanning Service, Web Site Design Service, Graphic Designers, Music CDs & Tapes, Shopping",[],,
Retail,Music Country,"728 Anderson Ave Cliffside Park, NJ 07010",,(201) 943-1045,"Musical Instruments, Shopping, Music CDs & Tapes, Wholesale Music, Musical Entertainers, Arts & Entertainment",[],,
Retail,Turnabout Inc,"93 Center St Garwood, NJ 07027",,(908) 789-2076,"Video Game Rental, Shopping, Video Games, Music CDs & Tapes",[],"Business Hours: Mon, Tue, Thur, Fri, 10am - 7pm; Sat, 10am - 6pm",
Retail,Grm Information Mgmt SVC,"215 Coles St Jersey City, NJ 07310",,(201) 798-7100,"Shopping, Government Contractors, Music CDs & Tapes, Record Storage, Engineering, Shop Online",[],Business Hours: Mon-Fri 9am-5pm,
Retail,Macy's,"114 US Highway 22 Springfield, NJ 07081",,(973) 376-8698,"Furniture, Discover Accepted, Discount Stores, American Express Accepted, Shop Online, Department Stores, Shopping, Men's Clothing, Vanities, Visa Accepted, Shoes, Mastercard Accepted, Women's Clothing, Children's Clothing",[],Business Hours: Sat 10am-8pm,
Retail,Ansonia Records Inc,"380 Kamena St Fairview, NJ 07022",,(201) 945-7600,"Shopping, Music CDs & Tapes",[],,
Retail,Stride Rite,"1100 Willowbrook Mall Wayne, NJ 07470",,(973) 256-0057,"Shoes, Childrens Shoes, Shopping",[],,
Retail,We Buy NJ Real Estate LLC,"4 Bloomfield Ave Bloomfield, NJ 07003",,(908) 578-1981,"Real Estate Consultants, Foreclosure Assistance, Estate Auctions, Shopping, Real Estate Sales & Services, Real Estate Investments, Real Estate Agents",[],"Business Hours: Mon-Fri 8am-7pm, Sat 8am-2pm, Sun Closed",
Retail,Corporate Essentials,"2 Cranberry Rd Ste 2A Parsippany, NJ 07054",,(973) 402-1088,"Wholesale Office Furniture, Wholesale Foods, Shopping, Office Product & Supply Sales, Unclassified, Advertising, Coffee & Tea Manufacturers, Coffee, Coffeehouses, Wholesale Distribution Centers",[],,
Retail,Allen Paper Supply,"PO Box 1262 Morristown, NJ 07962",,(973) 538-4826,"Shopping, Business Services",[],,
Retail,La Rumbita,"6409 Bergenline Ave West New York, NJ 07093",,(201) 662-5544,"Music CDs & Tapes, Shopping, Courier Services",[],,
Retail,Stride Rite,"651 Kapkowski Rd Ste 2004 Elizabeth, NJ 07201",,(908) 289-2724,"Shopping, Childrens Shoes, Shoes",[],,
Retail,Sears Hearing Aid Ctr,"51 US Highway 1 New Brunswick, NJ 08901",,(732) 937-7305,"Department Stores, Shopping, Hearing Aids",[],,
Retail,Macy's,"400 Commons Way Bridgewater, NJ 08807",,(908) 725-1400,"Mastercard Accepted, Department Stores, Children's Clothing, Computer Hardware, Visa Accepted, Shop Online, Women's Clothing, Shoes, Shopping, Men's Clothing",[],"Business Hours: Sun 11am-7pm, Mon-Thu 10am-9:30pm, Fri-Sat 9am-10pm",
Retail,Paramount Coffee SVC,"198 US Highway 46 Fairfield, NJ 07004",,(973) 575-0063,"Coffeehouses, Shopping, Coffee & Tea Manufacturers, Coffee",[],,
Retail,FYE,"755 State Route 18 # 542 East Brunswick, NJ 08816",,(732) 432-8389,"Video Games, Video Tape Manufacturers, Music CDs & Tapes, Shopping",[],"Business Hours: Mon - Sat, 10am - 9:30pm; Sun, 11am - 6pm",
Retail,Spencer Gifts Llc,"6826 Black Horse Pike Egg Harbor Township, NJ 08234",,(609) 645-3300,"Marketing Consultants, Discount Stores, Shopping, Women's Clothing, Shop Online, Visa Accepted, Mastercard Accepted, Discover Accepted, Stationery Stores, Gift Shops, American Express Accepted",[],Business Hours: Fri 9am-5pm,
Retail,Sears Roebuck & Co,"50 US Highway 46 Wayne, NJ 07470",,(973) 890-2182,Shopping,[],,
Retail,Best Buy,"675 US Highway 1 S Ste 1 Iselin, NJ 08830",,(732) 596-1220,"Computer Equipment Manufacturers, Hitachi, American Express Accepted, Consumer Electronics, Video Tape Manufacturers, Car Stereos, Computer Hardware, Visa Accepted, Discover Accepted, Music CDs & Tapes, Office Furniture Manufacturers, Phone Equipment, Mastercard Accepted, DVDs, Car Alarms, Shopping, Electronics Sales, Video Games, Wholesale Office Furniture, TVs and Radios, Major Appliances, Cell Phone Service",[],"Business Hours: Sun 11am-8pm, Mon-Sat 10am-9pm",
Retail,Day Care Raritan,"3 Thompson St Raritan, NJ 08869",,(908) 392-4190,"Shopping, Child Care, Music CDs & Tapes",[],,
Retail,T & R Alarm Systems Inc,"189 Sargeant Ave Clifton, NJ 07013",,(973) 948-2827,"Burglar Alarm Manufacturers, Hitachi, Raised Floor Construction, Car Alarms, Wholesale Fire Alarm Systems, Wholesale Security Control Equipment, Security Equipment Manufacturers, Wholesale Medical Alarms, Check, Wholesale Burglar Alarm Systems, Wholesale CCTV Systems, Government Contractors, Visa Accepted, Security Systems Consultants, Discover Accepted, Security Services, Crowd Control, American Express Accepted, Safety Equipment & Clothing Manufacturers, Security Systems, Mastercard Accepted, Consumer Electronics, Turnstile Manufacturers, Fire Alarm Systems Manufacturers, Fence Contractors, Medical Equipment Manufacturers, Shopping",[],Business Hours: Mon. - Sun. 24 Hours,
Retail,Relic Record Shoppe,"140 Main St Hackensack, NJ 07601",,(201) 342-4848,"Music CDs & Tapes, Shopping",[],,
Retail,Macy's,"500 Garden State Plz Paramus, NJ 07652",,(201) 843-9100,"Department Stores, Discover Accepted, American Express Accepted, Visa Accepted, Women's Clothing, Shopping, Shoes, Mastercard Accepted, Children's Clothing, Auto Parts & Accessories, Discount Stores, Men's Clothing, Shop Online",[],Business Hours: Sat 9am-10:30pm,
Retail,Macy's,"237 Woodbridge Ctr Woodbridge, NJ 07095",,(732) 636-2450,"Discount Stores, Shopping, Department Stores, Shoes, Children's Clothing, American Express Accepted, Mastercard Accepted, Discover Accepted, Visa Accepted, Men's Clothing, Dentists, Women's Clothing, Shop Online",[],Business Hours: Sat 10am-10pm,
Retail,Flipside Records,"120 Wanaque Ave Pompton Lakes, NJ 07442",,(973) 835-8448,"Shopping, Music CDs & Tapes",[],"Business Hours: Wed 11am-6pm, Thu-Fri 11am-7pm, Sat 12pm-6pm",
Retail,Sears Service & Repair,"8000 National Hwy Pennsauken, NJ 08110",,(856) 317-2511,"Department Stores, Repair Shops, Shopping",[],,
Retail,La Explosiva II Record Shop,"283 Park Ave Newark, NJ 07107",,(973) 483-5566,"General Merchandise Stores, Shopping, Music CDs & Tapes",[],,
Retail,Sears Hardware Store,"1500 Route 47 Ste 21 Rio Grande, NJ 08242",,(609) 889-1725,Shopping,[],,
Retail,Amantel,"21 Holly Rd Iselin, NJ 08830",,(732) 983-4332,"Visa Accepted, Shopping, Diners Club Accepted, Mastercard Accepted, Discover Accepted, American Express Accepted, Shop Online, Telephone Companies, Telecommunications, Music CDs & Tapes",[],Business Hours: Daily 24 Hours,
Retail,Rockers Coffee Co,"133 Palisade Ave Cliffside Park, NJ 07010",,(201) 840-5463,"Coffee, Shopping, Coffee & Tea Manufacturers",[],,
Retail,Latino Records,"92 N Beverwyck Rd Lake Hiawatha, NJ 07034",,(973) 588-4889,"Shopping, Music CDs & Tapes",[],,
Retail,"TRADE 1 Audio , Video , Games & Electronics","712 US Highway 1 # 302 Edison, NJ 08817",,(732) 572-5556,"Consumer Electronics, Shopping, Video Games, Musical Instruments, Wholesale Music",[],"Business Hours: Sun 11am-6pm, Mon-Sat 11am-9pm",
Retail,Poncenos Record Shop,"109 Shrewsbury Ave Red Bank, NJ 07701",,(732) 842-5548,"Shopping, Music CDs & Tapes",[],,
Retail,Primavera Regency,"1080 Valley Rd Stirling, NJ 07980",,(908) 580-0707,"Shopping, Banquet Rooms, Catering",[],,
Retail,Main St Coffee,"311 W Main St Rockaway, NJ 07866",,(973) 627-6088,"Shopping, Coffee, Coffee & Tea Manufacturers",[],,
Retail,Grooveground,"647 Haddon Ave Collingswood, NJ 08108",,(856) 869-9800,"Music CDs & Tapes, Coffeehouses, Shopping, Restaurants",[],"Business Hours: Mon - Thu, 7am - 10pm; Fri, 7am - 11pm; Sat, 8am - 11pm; Sun, 8am - 10pm",
Retail,Record Menagerie,"300 Acorn Dr Bridgewater, NJ 08807",,(732) 563-1358,"Shopping, Music CDs & Tapes",[],,
Retail,The Smoking Dog Cigars Tobacco and Accessories,"300 S Lenola Rd Maple Shade, NJ 08052",,(856) 231-0202,"Visa Accepted, Pet Services, Discover Accepted, Cigarettes & Tobacco, Debit Card Accepted, Shopping, American Express Accepted, Mastercard Accepted",[],"Business Hours: M Closed, Tu-Sa 10am-8pm, Su 10am-4pm",
Retail,Macy's,"755 State Route 18 Ste 100 East Brunswick, NJ 08816",,(732) 238-1400,"Visa Accepted, Shopping, Computer Equipment Manufacturers, Department Stores, Mastercard Accepted, Children's Clothing, Women's Clothing, Discount Stores, Office Building Operators, Shop Online, Real Estate Operators, Men's Clothing, Computer Hardware, Shoes",[],Business Hours: Sat 10am-9:30pm,
Retail,Brick House Coffee,"3250 Shafto Rd Ste 8 Tinton Falls, NJ 07753",,(732) 938-9505,"Coffee, Coffeehouses, Coffee & Tea Manufacturers, Shopping",[],,
Retail,Discount Trailer Warehouse,"1946 N Black Horse Pike Williamstown, NJ 08094",,(856) 875-2112,"Recreational Vehicles, Camping & Travel Trailer Dealers, Boat Storage, All Terrain Vehicle Dealers, Trailer Dealers, Shopping, Auto & Utility Trailer Dealers, Wholesale Utility Trailers, Trailer Equipment Manufacturers, Wholesale Trailer Hitches, Auto Parts & Accessories",[],Business Hours: Mon 08:30 AM-05:30 PM;Tue 08:30 AM-05:30 PM;Wed 08:30 AM-05:30 PM;Thu 08:30 AM-05:30 PM;Fri 08:30 AM-05:30 PM;Sat 08:30 AM-03:00 PM,
Retail,Stride Rite,"500 Route 73 S Ste D15 Marlton, NJ 08053",,(856) 396-0232,"Visa Accepted, Mastercard Accepted, Childrens Shoes, Shoes, Shopping",[],,
Retail,Windsor Galleries,"2185 S Tiiu Ct Toms River, NJ 08755",,(732) 341-1929,"Appraisals, Clearance Sale, Business Services, Shopping, Real Estate Consultants, Real Estate Appraisals",[],"Business Hours: Sat-Sun 24 Hours, Mon-Fri 8:30am-6pm",
Retail,Puebla Travel & Latin Music,"129 Clifton Ave Lakewood, NJ 08701",,(732) 363-2424,"Shopping, Music CDs & Tapes, Travel Agencies",[],Business Hours: Mon. - Fri. 9am - 5pm;Sat. - Sun. CLOSED,
Retail,Boscov's,"6725 Black Horse Pike Egg Harbor Township, NJ 08234",,(609) 383-1880,"Eyeglasses, Shopping, Optical Goods, Department Stores, Milliners, Clothing Accessories, Travel Agencies, Mastercard Accepted, Visa Accepted",[],"Business Hours: Sun 11am-5pm, Mon-Sat 10am-9:30pm",
Retail,Action Coffee Company,"9 Lawton St Hackensack, NJ 07601",,(201) 342-7077,"Coffeehouses, Shopping, Coffee & Tea Manufacturers, Coffee",[],Business Hours: Mon-Fri 8am-5pm,
Retail,STORY at Macy's,"100 Willowbrook Mall Wayne, NJ 07470",,(973) 785-9525,"Mastercard Accepted, Men's Clothing, Children's Clothing, Shopping, Women's Clothing, Shop Online, Discount Stores, Diners Club Accepted, Wholesale Shock Absorbers, American Express Accepted, Department Stores, Shoes, Visa Accepted, Auto Parts & Accessories",[],,
Retail,Home Video Studio,"943 Carleton Rd Westfield, NJ 07090",,(908) 301-9300,"Movie Rentals, American Express Accepted, Wholesale Video Tapes & Discs, Audio-Visual Production, Movies, Photographers, Visa Accepted, Shopping, Arts & Entertainment, Discover Accepted, Motion Picture Industry, Commercial Photography, Debit Card Accepted, Film Editing, Photography, Mastercard Accepted, Videography, Video/DVD Duplication, Media Services, Photo Finishing",[],"Business Hours: Mon-Fri 10am-6pm, Sat 10am-1pm",
Retail,Coffee Distributing Corp,"180 Atlantic Ave Long Branch, NJ 07740",,(732) 481-0870,"Wholesale Distribution Centers, Advertising, Coffee, Coffee & Tea Manufacturers, Shopping",[],,
Retail,Sears Prestige Automobile,"977 S Elmora Ave # 983 Elizabeth, NJ 07202",,(908) 282-1555,"Used Car Dealers, Shopping",[],Business Hours: Mon-Sat 9:30am-7:30pm,
Retail,Boscov's Department Store,"1201 Hooper Ave Ste A Toms River, NJ 08753",,(732) 505-0770,"Department Stores, Visa Accepted, Shopping, Travel Agencies, Mastercard Accepted",[],,
Retail,Taylors Closet,"212 Avenue B Bayonne, NJ 07002",,(732) 527-0724,Clothing,[],,
Retail,Inwentarz C,"426 Mountain Way Morris Plains, NJ 07950",,(973) 285-7590,"Software, Computers, Computer Programming Services, Computer Support Services",[],,
Retail,Epeople Technologies Inc,"1259 US Highway 46 Bldg 2 Parsippany, NJ 07054",,(973) 299-7600,"Personnel Consultants, Computer Programming Services, Software, Computers, Computer Support Services",[],,
Retail,Citi Storage,"107 W Side Ave # A Jersey City, NJ 07305",,(201) 524-9657,"Household Storage, Software, Storage, Commercial Storage, Paper Product Manufacturers, Record Management Consultants, Health & Medical Services, Record Storage",[],Business Hours: Daily 12pm-12am,
Retail,Atinav Inc,"285 Davidson Ave Ste 403 Somerset, NJ 08873",,(732) 412-3000,"Computers, Computer Support Services, Software",[],,
Retail,Thomson Reuters,"121 River St Ste 1000 Hoboken, NJ 07030",,(201) 610-1211,"Software, Computers, News Service, Computer Support Services, Computer Programming Services, Finance & Financial Services, Publishing",[],Business Hours: Mon. - Fri. 9am - 5pm;Sat. - Sun. CLOSED,
Retail,Nj Asphalt Assoc,"500 Horizon Center Blvd Ste 520 Trenton, NJ 08691",,(609) 838-1867,"Clothing, Road Construction, Business Organizations, Sleepwear",[],Business Hours: Mon-Fri 8:30am-4pm,
Retail,Stellar Home Care & Staffing,"149 S Euclid Ave Westfield, NJ 07090",,(732) 564-7550,"Assisted Living Facilities, Home Health Care, Sleepwear, Senior Citizens' Services, Men's Sportswear Manufacturer, Clothing, Nurses, Wholesale Sporting Goods, Alzheimers Information, Athletic Clothing, Wholesale Sportswear, Health & Medical Services",[],Business Hours: Open Daily 24 Hours ; Open Holidays ; Appointments Available ; 24 Hour Emergency Service Available,
Retail,"Weir, Lisa: Lisa Weir","13 Robbin St Monmouth Beach, NJ 07750",,(732) 222-5522,Software,[],,
Retail,Rangel Fashion Store,"5812 Palisade Ave West New York, NJ 07093",,(201) 624-8705,"Clothing, Sleepwear, Fashion Designers",[],,
Retail,Firmost Systems Llc,"111 Kinderkamack Rd River Edge, NJ 07661",,(201) 266-8641,"Computer Support Services, Computers, Computer Programming Services, Software",[],,
Retail,Makarios Clothing Store,"932 Main Ave Passaic, NJ 07055",,(973) 246-1710,"Clothing, Sleepwear",[],,
Retail,J McLaughlin,"89 Bridge Ave Bay Head, NJ 08742",,(732) 475-6761,"Clothing, Shop Online, Women's Clothing, Custom Clothing, Sleepwear",[],"Business Hours: Sun 12pm-5pm, Fri-Sat 10am-6pm",
Retail,American Well Corp,"96 Forrest Hills Dr Voorhees, NJ 08043",,(856) 753-1004,"Computer Support Services, Software, Water Well Drilling, Computers",[],,
Retail,Sunwear Fashion LLC,"110 Triangle Blvd Carlstadt, NJ 07072",,(201) 528-7642,Clothing,[],,
Retail,Ricciardi Brothers,"38 State Route 10 East Hanover, NJ 07936",,(973) 888-6898,Paint,[],,
Retail,Cdk Systems Inc,"238 Silver Bay Rd Toms River, NJ 08753",,(732) 830-8993,"Computers, Computer Support Services, Software, Computer Programming Services",[],Business Hours: Mon. - Fri. 9am - 5pm;Sat. - Sun. CLOSED,
Retail,Maripsa's Fashion,"1808 S Broad St Trenton, NJ 08610",,(609) 392-5020,Clothing,[],,
Retail,Astrix Software Technology,"1090 King Georges Post Rd Ste 604 Edison, NJ 08837",,(732) 661-0410,"Computers, Software, Computer Support Services",[],,
Retail,Ici Dulux Paint,"975 New Durham Rd Edison, NJ 08817",,(732) 287-9440,"Wallpaper & Wallcoverings, Wholesale Paint, Government Contractors, Paint",[],,
Retail,Rohr Systems Inc,"5033 Industrial Rd Ste 3 Wall Township, NJ 07727",,(732) 751-2700,"Computer & Internet Services, Computer Support Services, Software, Industrial Equipment Repair, Computers, Computer Repair, Government Contractors, Computer Parts",[],,
Retail,Jvn Communications Inc,"707 White Horse Pike Absecon, NJ 08201",,(609) 569-1477,"Software, Government Contractors, Communications Consultants",[],,
Retail,Lowe Key Fashion Finds,"1023 Stuyvesant Ave # B Union, NJ 07083",,(908) 349-8163,"Clothing, Fashion Consultants",[],,
Retail,After Hours,"6725 Black Horse Pike Egg Harbor Twp, NJ 08234",,(609) 646-6211,"Tuxedo Rental, Shop Online, Alterations, Men's Clothing, Clothing, Department Stores, Formal Wear",[],,
Retail,Special-T-Graphics INC,"3105 Bridge Ave Point Pleasant Boro, NJ 08742",,(732) 899-7240,"Sleepwear, Screen Printing, Silk Screening, Clothing",[],,
Retail,Marshalls,"1520 N Olden Avenue Ext Ewing, NJ 08638",,(609) 392-3652,"American Express Accepted, Mastercard Accepted, Discover Accepted, Clothing, Discount Stores, Women's Clothing, Shoes, Sleepwear, Department Stores, Men's Clothing, Visa Accepted",[],"Business Hours: Mo-Fr 9:30am-9:30pm, Sa 9:30am-9:30pm, Su 11am-8pm",
Retail,Hustle Mania Llc,"112 North Ave Plainfield, NJ 07060",,(908) 444-8799,"Clothing, Sleepwear",[],,
Retail,TSR Inc,"451 Doremus Ave Newark, NJ 07105",,(973) 344-4687,"Computers, Software, Computer Support Services",[],,
Retail,Third Wave Business Systems,"475 Market St Ste 101 Elmwood Park, NJ 07407",,(201) 703-2100,"Computer Programming Services, Software, Computers, Wholesale Business Forms, Computer Support Services",[],,
Retail,H&M,"112 Eisenhower Pkwy Ste 101 Livingston, NJ 07039",,(973) 992-9020,"Clothing, Visa Accepted, Mastercard Accepted, Sleepwear",[],"Business Hours: Mon - Fri, 10am - 9pm; Sat, 10am - 9:30pm; Sun, 11am - 6pm",
Retail,Lemon Pop,"1592 Kings Hwy N # 26 Cherry Hill, NJ 08034",,(856) 616-2980,"Jewelry, Gift Shops, Shoes, Clothing",[],"Business Hours: Sun 10am-8pm, Mon-Sat 10am-9pm",
Retail,Mbm Sports Ctr,"415 Egg Harbor Rd Sewell, NJ 08080",,(856) 589-0801,"Clothing, Sporting Goods, Sleepwear",[],"Business Hours: Sun 11am-3pm, Mon-Fri 10am-7pm, Sat 10am-5pm",
Retail,Iton Llc,"24 Plaza 9 Manalapan, NJ 07726",,(732) 625-0098,"Computer Support Services, Computers, Software, Computer Programming Services",[],Business Hours: Mon. - Fri. 9am - 5pm;Sat. - Sun. CLOSED,
Retail,Xmarxthespot,"9 S Broadway Pitman, NJ 08071",,(856) 582-6888,"Clothing, Sleepwear",[],,
Retail,Alza Management Corp,"781 Oneida Trl Franklin Lakes, NJ 07417",,(201) 848-7330,"Software Publishers, Software",[],,
Retail,Active Orthopaedics & Sports,"390 Old Hook Rd Ste 103 Westwood, NJ 07675",,(201) 358-0707,"Surgeons, Doctors, Visa Accepted, Clothing, Sleepwear, Athletic Clothing, Sports Medicine Doctors, Orthopedic Surgeons, Mastercard Accepted, Health Clinics",[],Business Hours: Mon. - Fri. 9am - 5pm;Sat. - Sun. CLOSED,
Retail,Advanced Apparels Inc,"89 Leuning St South Hackensack, NJ 07606",,(201) 342-4912,Clothing,[],,
Food and Beverage,Garden State Discount Liquors,"895 Convery Blvd Perth Amboy, NJ 08861",,(732) 442-9536,"Liquor Stores, Wine Stores, Food & Dining",[],,
Food and Beverage,Motorcycle Mall,"655 Washington Ave Belleville, NJ 07109",https://apis.elocal.com/tracker/track?q=7505a5af6ec224ac5015f2ed7648ce134659c4853d7ec169f6d085417cc467e4ec6dff0a5d1a89f78915cf75549232451477c652009554acb7adc8307ba49c544e92e5875c832d162155958487cbf189ef01f4cab8452a198909a3c1e35100fceaa87d9f1c55c4ad7a1f61c1f95287fbffea18f4933f9c0e37e6ae5433659a8a4fef76361f2f15cc5a406755e3753811b37f007bf18ed60be4014559d46d69a4104246c42c7099012eef8ae661ddbda9197c4cd62ea30858f60304ee9f8ee571c705b6981b6b3f49e5526705101f46517687f14f1c294c038b71961b9dd0ac5a96b193fb9a969684164865253b40dd15d4829ce929c8949e13cc80ac11b172a3f6947b1718203595eec99c0c6343188a7eb4eaff3b176d32de9df716bb4f18b71a63954565ecdfb5e0f7b6313cbdbad8eb0ad282a7b90f0bb9365ca273b520b40d375312033d561335c4e8e3873719bcb8d390ef25c40ca5b511db4dbf6d2342e7a111e6e4575d87969e9fc44d89a60aea23ed26375af6494639c591809a960cd0f6b856ba3a62e7866e376408ed5a9555b0df02729140b06034f61d492ddc089f1cead8419cbed63f1d410e2d3b766686202663aa7d4d03f999f593b01942712a7a4816ecb36842a77478c8e48386a22fc8ac8e86c5cea1c4d54956fdf3ef2d252dfc38f84128718dbd8a2f11181aa4c4f8d4aa615c599067bbd1fad33f444ff891f13d1041e118f97d4f31e0e2f0485f9e73b16eacae87986763fbdfd05691b521f5944dd7dd0b64e4598cf9e1018aaeaf24072d0207aa43a25b76b07d12088b5ae47a0c96317b62b27bc10090ff5f62a4c7e9f26b9663e98a7570296f101fec9de8e846ebc62d7b392b7991fc86873a5f9f1fa50ee420d26469d6f8fdda919c5f750d8c00c14c8bf7291504426e90a2720149dce2871f2ebd68e120a9cc4fb0e56407614641dbd6fbdb8cef16387c0f7ecdb4c607c6db2b18b6c0719fc558,(973) 751-4545,"Food & Dining, Artists","['Tamer@MotorcycleMall.com', 'Rich@MotorcycleMall.com', 'JohnRez@MotorcycleMall.com', 'NickPierson@MotorcycleMall.com', 'natasha@motorcyclemall.com']","Business Hours: Mon 10:00-18:00,Tue 10:00-20:00,Wed 10:00-18:00,Thr 10:00-20:00,Fri 10:00-18:00",
Food and Beverage,Paul's Bar & Bowling,"377 Crooks Ave Paterson, NJ 07503",,(973) 278-1982,"Food & Dining, Bars & Clubs",[],,
Food and Beverage,The Cycle Exchange,"65 Main St Andover, NJ 07821",https://apis.elocal.com/tracker/track?q=863328b509137de90dcbb7fc926538441ad6874d9d9b11145d0ff0627f7cba5ebea21f959425debda7943e1631c2562ecc2b3ad6db4155af1593843ccf7fdd94b931173f275bed16dc20e69e4edb913b097c06507ef8e6e53d4d2b905bb866b980b64910b4494e0c0a50c19628d2b0cda0e6fd01eccbc424e24ba52cf8517a20fb3d65a7b64758023803421b21fd1d189cb7a3a1b403ab924fc9bdce269d990405967e871f90389075e2fe43ffc9324a1f95d2223d247083cde10535d42d96528a14e1690663b20b1813e84ced845675323d77324188894d287c06c250c9cac4f4131915cb8266255c799b5c1785d85da87664b8b10372b0ff3e4d7d948c2307d09922b8fcfed65a25177e395285e68b5ec7f1459fe8ce4b5fff5f1b5413f4065d6f4dfca06d38fdcf97b040c46acbfe1983f76b4ba3cd96a2b66874757e1450a16247e244f5415a6cedb043ca60eb1a16aaac624fea6c757e78a104a8c2722155ffbe2b2496889c02b3445f49a71a4e1040d4213e6056bdaa94c140bb6116deb9dc82fb6b1e5cf0a5d40185cb7aef0dd28aa7262b264b273d704b924d580e5a75b8ebe148ca58e3e21795c35c6bed298b920c8ec8f2634d981d2265fce88c37ef1fb773f3128e41832838295b3bd9e0885ddd9a2e4e89be2026b019a1c94859c67b15e1d6ef875861137a9da0e5f58f40602c3e8c2990f76ed27bd66b5a9b5b8a26bae16e4ec5b4bc7a03e7442d43bcc13d5800577fc1a39ab1487ba0cc7011f8ffc99aeeb62652d925eddb9a88f1e5160a18ec9be3d7f1534a0646c9c00a71c89767c79cb5f64596efcb9e2759d734f684f592d2f9b97107575125b702e3455e7b90bd026e609ca77ceed087eb532cf1ee4ccd95e7ad979f84e8d598634ad3b3d11805a230d1f970ced4ade8ec6cfc14553f5c8c43a643d7634a6e799ab91ad3786365dce45c9b0665b8c9ca8ddf66912d2c648ff6d93ba08f3939923330af,(973) 786-6966,"BMW, Barber Schools, High Schools, Food & Dining",['sales@thecycleexchange.com'],"Business Hours: Tue 10:00-17:00,Wed 10:00-17:00,Thr 10:00-17:00,Fri 10:00-17:00,Sat 10:00-16:00",
Food and Beverage,Clarksburg Inn,"465 Stagecoach Rd Millstone Township, NJ 08510",,(609) 259-2558,"Food & Dining, Banquet Rooms, Beer, Restaurants",[],"Business Hours: Sun 9am-10pm, Mon-Fri 12pm-12am, Sat 11am-12am",
Food and Beverage,Community Meals Inc-Meals On,"105 Cottage Pl Ridgewood, NJ 07450",,(201) 447-8295,"Food & Dining, Churches, Home Health Care",[],Business Hours: Mon-Fri 10am-2pm,
Food and Beverage,Stirling Fine Wines,"1168 Valley Rd Stirling, NJ 07980",,(908) 649-0084,"Beer, Food & Dining, Wine Stores, Liquor Stores",[],"Business Hours: M-W 9am-9pm, Th-Sa 9am-10pm, Su 10am-6pm",
Food and Beverage,Portobello,"175 Ramapo Valley Rd Oakland, NJ 07436",,(201) 337-8990,"Restaurants, Food & Dining, Personal Services, Wedding Planners, Catering, Italian",[],"Business Hours: Fri-Sat: 11:30am-11pm, Mon: 11:30am-10pm, Thu: 11:30am-10pm, Sun: 11am-9pm",
