industry,business name,address,external link,phone number,additional_info,emails,business hours,teaser
Construction,Complete Construction,"234 Hawthorne Ave Point Pleasant Beach, NJ 08742",,(732) 202-6910,"Construction Consultants, Construction Companies",[],,
Construction,Bell Construction,"2 Gable Walk Livingston, NJ 07039",,(973) 535-0758,"General Contractors, Construction Consultants, Construction Companies",[],,
Construction,Ghavin Construction,"11 N Harrison St East Orange, NJ 07017",,(862) 252-6006,"Construction Companies, Construction Consultants",[],,
Construction,Wyshinski Construction,"61 Acton Station Rd Salem, NJ 08079",,(856) 279-2355,"Construction Companies, Construction Consultants",[],,
Construction,Jayeff Construction,"520 Route 70 Brick, NJ 08723",,(732) 920-8600,"Construction Consultants, Construction Companies",[],,
Construction,Gabi's Construction,"889 US Highway 206 Bordentown, NJ 08505",,(877) 494-9264,"Construction Companies, Roofing Contractors, Roofing Consultants, Construction Consultants",[],Business Hours: Daily 7am-7pm,
Construction,Diamondhead Construction,"6 Willow Grove Pkwy Westfield, NJ 07090",,(908) 789-7494,"Construction Consultants, Architects",[],,
Construction,Fimiani Construction,"935 New Durham Rd Edison, NJ 08817",,(732) 287-1734,"Excavation Work, General Contractors, Asphalt Paving Contractors, Snow Removal, Excavating Contractors, Paving Contractors, Masonry, Concrete Sealing, Road Construction, Foundation Contractors, Driveways",[],Business Hours: Daily 24 Hours,
Construction,Bird Construction,"105 Harbor Inn Rd Bayville, NJ 08721",,(732) 269-1333,"Construction & Remodeling, Dock Builders, Marine Contractors, Wholesale Bulkheads, Government Contractors, Construction Consultants, Marinas, Pile Driving",[],Business Hours: Mon-Fri 9am-5pm,
Construction,Lavalette Construction,"3250 Route 35 N Lavallette, NJ 08735",,(732) 830-0136,Heavy Construction,[],,
Construction,Rejment Construction,"800 W Elm St Linden, NJ 07036",,(908) 862-4101,Construction Consultants,[],,
Construction,Juan & Sons Construction,"1120 50th St North Bergen, NJ 07047",,(201) 232-5744,"Construction Site Clean-Up, Home Repair & Service, Window Repair, Construction Consultants, Home Repair & Service, Kitchen Remodeling, General Contractors, Construction & Remodeling, Cabinets, Cabinets, Masonry, Roofing Contractors, Kitchen Cabinets, Construction Management, Bathroom Remodeling, Construction Companies, Floor Contractors",[],Business Hours: Mon-Sat 6am-10pm,
Construction,Brandt Construction Co,"265 Zion Rd Hillsborough, NJ 08844",,(908) 369-8926,"Asphalt Paving Contractors, Construction Companies, Masonry, Excavating Contractors, Concrete Contractors, Culverts, Parking Lot Maintenance, Paving Contractors, Driveways, Foundation Contractors, Construction Consultants, Blacktopping",[],Business Hours: Daily 24 Hours,
Construction,"Villari Construction, LLC","46 Cedar Inn Dr Toms River, NJ 08755",,(732) 341-2100,"Concrete Contractors, Excavating Contractors, Road Construction, Foundation Contractors, Construction Management, Paving Contractors, Masonry, Driveways, Construction Companies, Stone Contractors",[],Business Hours: Mon-Fri 8am-4:30pm,
Construction,Coleman Construction Services,"1483 Earie Way Forked River, NJ 08731",,(609) 488-6388,"Business Consultants, Construction Companies, Construction Consultants",[],Business Hours: Mon-Fri 9am-5pm,
Construction,"GLB Construction, LLC","458 Livingston Dr East Windsor, NJ 08520",,(609) 598-1434,"Flat Roof Installation, Roofing Contractors, Asphalt Shingle Installation, Construction Consultants, Tile Roof Installation, Vinyl Siding Installation, Repair Metal Siding, Roof Repair, Metal Roofing Contractors, Roofing Consultants, General Contractors, Vinyl Siding Repair, Wood Siding Repair, Wood Siding Installation, Construction Companies, Install Slate Roofs, Metal Roof Repair",[],Business Hours: Daily 7am-7pm,
Construction,Leone Construction Inc,"18-19 River Rd Fair Lawn, NJ 07410",,(201) 797-6400,"Construction Consultants, Construction Companies",[],,
Construction,Frazer Construction & Roofing,"34 Burt St Bridgeton, NJ 08302",,(856) 451-9403,"Construction Companies, Deck Builders, Roofing Contractors, Flagstone Manufacturers, Other Nonresidential Construction, Home Remodeling Contractors, General Contractors, Heavy Construction, Construction & Remodeling, Real Estate Developers",[],Business Hours: Mon-Fri 8am-5pm,
Construction,"Freitas Construction, LLC","813 Hemlock Rd Union, NJ 07083",,(888) 298-0867,"Home Builders, Construction Consultants, Construction & Remodeling, Real Estate Developers, Construction Companies, Roofing Consultants, Roofing Contractors",[],Business Hours: Daily 7am-7pm,
Construction,Allisson Construction LLC,"237 Verona Ave Newark, NJ 07104",,(973) 484-2309,"Construction Companies, Construction Consultants, Home Builders",[],,
Construction,Tedder Construction Inc,"8 Springhill Dr Howell, NJ 07731",,(732) 370-1200,"Construction Consultants, General Contractors, Architects",[],,
Construction,Jocama Construction Corp,"322 Spring Valley Rd Old Bridge, NJ 08857",,(732) 591-1010,"Building Materials, Quarries, Construction Consultants",[],,
Construction,Gantert Construction Inc,"23 Indian Spring Trl Denville, NJ 07834",,(973) 625-8081,"Architects, Construction Consultants, Residential Construction, Construction & Remodeling",[],,
Construction,Stavola Construction Materials,"810 Thompson Ave Bound Brook, NJ 08805",,(732) 356-7100,"Building Materials, Asphalt Paving Manufacturers, Road Construction, Stone Product Manufacturers, Quarries, Cut Stone Manufacturers",[],,
Construction,Best Construction Inc,"75 Rome St Newark, NJ 07105",,(973) 466-1138,"General Contractors, Construction Consultants, Architects",[],,
Construction,Rappa Construction Remodeling,"63 Birch St Kenilworth, NJ 07033",,(908) 272-7245,Heavy Construction,[],,
Construction,C K Construction,"4 N Hood Ave Audubon, NJ 08106",,(856) 672-9293,"Basement Remodeling, Plumbing Contractors, Bathroom Remodeling, Disability Accessibility Compliance, Real Estate Developers, Deck Builders, Construction & Remodeling, Heavy Construction, General Contractors",[],Business Hours: Mon-Fri 8am-5pm,
Construction,L & G Construction,"138 Demott Ave Clifton, NJ 07011",,(973) 471-0741,"Construction & Remodeling, Construction Consultants, Architects",[],,
Construction,Stearn Brothers Construction,"178 Black Horse Ln North Brunswick, NJ 08902",https://apis.elocal.com/tracker/track?q=3c25586c402136196d411eb5b7e6e421a6744854e7c9ceaad990bdc06b5d3a98c4254f7334b93d1a302c479d2103d804912630c5186b3a7e0d6d87fb643bd337a913a5aff949d4aacd0576511fba9bd53d11b1aa4a290b3ebf0516cb6acf47892bbcfcf7135caad3331e75dc5fdc08501b62a119b39a24e016f5e8d0c0d5ef6c6fe63cc216d156cc62079f850cd4388d03de5dd01e73317c30eeb8b1d08944ebb5d94f624f93a0b714b883209710ac1083b9ec2be38f3dd66ea934f8155aa1e88b601ac5a79832ae48cb8de7352655aa4d136fb69782d8f483f6d09c9a55e3131db27b952701b17fc1f8e60b5ae7fde26732c4828e27f4596c42276d2dda66e2051e55c538d32ab8136a617574dee3168e780ad44089be28eeb1d2fc31dc8a977c1801e1021edde45e720909861d6cb17082dc31d915ef6bf4bdc23e92332be4816476dc868dfd9b0867e40dd9840718934cd6235d3b08ef104bdfe069f723b9b980b3096077eddfef97a2330781de92da2e4ab1fa68cc14eb4c0cf59f56053c4409b3c5af71dda7e9bdd84af7ab70823f135c2329c79eae07dbced836d052ddcd7f9e8a6e68ea6675c84c6017e01779227abda26e33e4a5da3a4936173fa39a19cdefb7cd03cca1b29998046d4943af487425175eabda1b0f8cfb4fde73f242028d9a77ff3b5afe10ac4dbcfad43393c517825e25917ddfe346356c3d54b54322887c662e0281990bdc18698a8a9ecb7de2a4844c98f054074cb20d9386daef45b027e092f7ea0074bc593cc4170ffaa4bd3532c9056dd802d49da7cb28c23cc049d5fbe8077f9a1e52fb4269b381350adb5efc0e885af69d246a1c989e2b2f4f97abee515e61cf189398cbfa0b6e3321f6d8427e88c98bd6e72bc6799e96c387db4de49e8bf9d993eca00a921bbcdf343a1c5c4bbec0d16a76cad7381cfb4d2dcc1fd7ff0a324f655d933e0a59b6983f415b6eac2aa7d467cfbe1cb6ed71c0,(732) 374-9924,"Stearn Brothers Construction is a licensed residential and commercial roofing contractor serving the North Brunswick and Trenton, NJ areas since 1989. Our proprietors Richard, Todd and Mark Stearn are second generation roofers who specialize in roofing construction and repair as well as siding and trim. We serve the entire Middlesex, Mercer, and parts of Somerset County, NJ area - from Princeton to Woodbridge and every town in between. All of our work is owner-supervised. We work directly with our crews - no exceptions.",['richstearn@gmail.com'],,
Construction,Jamshar Construction Consultants L.L.C.,"78 Pinafore Ln # 1 Willingboro, NJ 08046",,(609) 680-2069,"Construction Consultants, Construction Companies",[],,
Construction,L & L Mechanical Construction,"325 Main St East Rutherford, NJ 07073",,(201) 804-1346,"Pipe & Boiler Covering Contractors, Construction Consultants, Mechanical Contractors, Welding, Construction Companies",[],,
Construction,Mohammed Construction,"302 Totowa Ave Paterson, NJ 07502",,(973) 330-7941,Construction Companies,[],,
Construction,Agate Construction,"6572 Black Horse Pike Mays Landing, NJ 08330",,(609) 837-2796,"Construction Companies, Construction Management, General Contractors",[],,
Construction,Patock Construction,"1001 US Highway 9 Howell, NJ 07731",,(732) 431-3185,"Construction Companies, General Contractors",[],,
Construction,Patock Construction,"25 Byron Pl Livingston, NJ 07039",,(973) 251-2501,"Construction Companies, Construction Management",[],,
Construction,Enf Construction,"317 MacArthur Ave Garfield, NJ 07026",,(973) 928-3593,"General Contractors, Construction Companies",[],,
Construction,Whitesell Construction,"760 Centerton Rd Mount Laurel, NJ 08054",,(856) 234-6423,"Construction & Remodeling, Construction Companies, General Contractors, Real Estate Consultants",[],,
Construction,Oliver Construction,"105 E Route 130 N Burlington, NJ 08016",,(609) 614-7710,"Construction Companies, General Contractors",[],,
Construction,Copeland Construction,"729 Riverside Ave Lyndhurst, NJ 07071",,(201) 935-1510,Construction Companies,[],,
Construction,Daja Construction,"400 E 54th St # A Elmwood Park, NJ 07407",,(201) 254-9762,Construction Companies,[],,
Construction,Striker Construction,"918 N Wood Ave Linden, NJ 07036",,(908) 486-4578,"General Contractors, Construction Companies",[],,
Construction,Vanore Construction,"60 Fulton Ave Clementon, NJ 08021",,(856) 784-9400,"Insulation Contractors, Plastering Contractors, Siding Contractors",[],,
Construction,Woetco Construction,"1 Constitution Dr Howell, NJ 07731",,(732) 850-1721,Construction Companies,[],,
Construction,Menture Construction,"69 Atlantic Ave Keansburg, NJ 07734",,(732) 495-2091,Construction Companies,[],,
Construction,Zammit Construction,"403 N Carolina Trl Browns Mills, NJ 08015",,(609) 893-9107,Construction Companies,[],,
Construction,Macedonia Construction,"104 Gilbert Ave Elmwood Park, NJ 07407",,(201) 703-0557,"Construction Companies, Churches",[],,
Construction,Buch Construction,"401 Clearview Rd Edison, NJ 08837",,(732) 512-0251,Construction Companies,[],,
Construction,Adam Construction,"245 4th St Passaic, NJ 07055",,(973) 777-3025,"Construction Companies, General Contractors",[],,
Construction,Abr Construction,"1525 Argonne Ave Forked River, NJ 08731",,(609) 242-8526,"General Contractors, Construction Companies",[],"Business Hours: Tue-Wed 9am-3pm, Fri 9am-3pm, Sat 9am-1pm",
Construction,Juan Construction,"407 Monroe St Passaic, NJ 07055",,(862) 668-4515,Construction Companies,[],,
Construction,Sierra Construction,"25 Shadowlawn Dr Colonia, NJ 07067",,(732) 381-0731,Construction Companies,[],,
Construction,Nicosia Construction,"3 Pittenger Ct Millstone Twp, NJ 08535",,(732) 446-0449,Construction Companies,[],,
Construction,Waterside Construction,"7601 River Rd North Bergen, NJ 07047",,(201) 624-8357,Construction Companies,[],,
Construction,Lemus Construction,"79 US Highway 202 Ringoes, NJ 08551",,(908) 237-3655,"Construction Companies, Construction & Remodeling",[],,
Construction,Sweetwater Construction,"315 Robbinsville Allentown Rd Trenton, NJ 08691",,(609) 208-2151,"Construction Companies, General Contractors",[],,
Construction,Benchmark Construction,"1102 Warren Ave Cherry Hill, NJ 08002",,(856) 461-8600,"General Contractors, Roofing Contractors, Siding Contractors, Construction Companies, Kitchen Remodeling",[],Business Hours: Sun Open 24 Hours;Mon Open 24 Hours;Tue Open 24 Hours;Wed Open 24 Hours;Thu Open 24 Hours;Fri Open 24 Hours;Sat Open 24 Hours,
Construction,Railroad Construction,"691 Mill Creek Rd Manahawkin, NJ 08050",,(609) 597-4743,"Construction Companies, Railroad Contractors, General Contractors",[],,
Construction,Gallo Construction,"522 Miller Ave Trenton, NJ 08610",,(609) 631-8728,"Plastering Contractors, Insulation Contractors, Other Nonresidential Construction, Siding Contractors",[],,
Construction,Christopher Construction,"176 1st Ave West Berlin, NJ 08091",,(856) 210-6146,"Construction Companies, Roofing Contractors, Home Remodeling Contractors",[],Business Hours: Sun-Fri 6am-6pm,
Construction,Pinnacle Construction,"2113 Bay Ave Ocean City, NJ 08226",,(609) 545-8276,Construction Management,[],,
Construction,Whitman Construction,"2511 Route 88 Point Pleasant Boro, NJ 08742",,(732) 295-0875,"Construction Companies, General Contractors",[],,
Construction,Ferreira Construction,"155 Park Ave Lyndhurst, NJ 07071",,(201) 340-4077,Construction Management,[],,
Construction,Army Construction,"730 Broad St Ste 3 Clifton, NJ 07013",,(973) 777-5577,"Foundation Contractors, Painters, Stone Contractors, Masonry, General Contractors, Waterproofing Contractors, Concrete Contractors, Construction Companies, Roofing Contractors, Roofing Consultants, Metal Roofing Contractors",[],Business Hours: Mon-Sat 9am-5pm,
Construction,Rodriguez Construction,"92 Hudson Ave Ridgefield Park, NJ 07660",,(201) 803-5301,"Roofing Contractors, Painters, Kitchen Remodeling, Floor Contractors, Bathroom Remodeling, Construction Companies",[],Business Hours: Mon 06:00 AM-07:00 PM;Tue 06:00 AM-07:00 PM;Wed 06:00 AM-07:00 PM;Thu 06:00 AM-07:00 PM;Fri 06:00 AM-07:00 PM;Sat 06:00 AM-07:00 PM,
Construction,Callahan Construction,"1-08 Morlot Ave Fair Lawn, NJ 07410",,(201) 873-4158,"Snow Removal, Concrete Contractors, Culverts, Plumbing Contractors, Concrete Foundation Installation, Construction & Remodeling, Concrete Resurfacing, Sump Pump Installation, Construction Companies, General Contractors, Concrete Stamping",[],Business Hours: Mon-Fri 24 Hours,
Construction,County Construction,"151 Bradley Ave Bergenfield, NJ 07621",,(201) 384-5300,"Construction Companies, Swimwear, Construction & Remodeling",[],,
Construction,Frascino Construction,"125 Columbia Ave Jersey City, NJ 07307",,(866) 907-0765,"Asphalt Shingle Installation, Wood Gutter Repair, Tuck-Pointing, Roof Sealant Application, Synthetic Stucco Siding Repair, Painters, Deck Builders, Construction Companies, Wood Gutter Installation, Patio & Deck Cleaning & Restoration, Kitchen Remodeling, Door Hanging, Home Repair & Service, Vinyl Siding Installation, Handyman, Storm Shelter Contractors, Roof Repair, Roof Cleaning, Home Remodeling Contractors, Fence Contractors, Masonry, Repair PVC Gutters, General Contractors, Install PVC Gutters, Plastering Contractors, Basement Remodeling, Vinyl Siding Repair, Bathroom Remodeling, Stone Wall Repair, Dry Wall Contractors, Block Wall Installation, Basement Waterproofing",[],,
Construction,Abeck Construction,"28 S Main St Wharton, NJ 07885",,(973) 343-6006,"Construction Companies, General Contractors",[],,
Construction,Chanik Construction,"427 Laurel Blvd Lanoka Harbor, NJ 08734",,(609) 693-1181,Construction Companies,[],,
Construction,Wahl Construction,"107 Saint Andrews Dr Egg Harbor Twp, NJ 08234",,(609) 927-5557,Construction Companies,[],,
Construction,Parker Construction,"115 S Pine Ave Maple Shade, NJ 08052",,(856) 482-5644,Construction Companies,[],,
Construction,Construction Concepts,"1070 Kings Hwy Bellmawr, NJ 08031",,(856) 933-9404,"Storage, Construction Management, Construction Companies",[],,
Construction,Coveney Construction,"2 Log Rd Lake Hopatcong, NJ 07849",,(973) 663-4704,Construction Companies,[],,
Construction,Lia Construction,"24 Hampshire Dr Mendham, NJ 07945",,(973) 543-1888,Construction Companies,[],,
Construction,Farhat Construction,"232 72nd St North Bergen, NJ 07047",,(201) 472-3667,Construction Companies,[],,
Construction,Kugeneral Construction,"51 Haring St Closter, NJ 07624",,(201) 783-5266,Construction Companies,[],,
Construction,Alfa Construction,"601 18th St Union City, NJ 07087",,(201) 770-1944,Construction Companies,[],,
Construction,Ritacco Construction,"276 N Main St Pennington, NJ 08534",,(609) 303-0279,"Construction Companies, Concrete Contractors",[],,
Construction,Midcon Construction,"340 E 25th St Paterson, NJ 07514",,(973) 930-5942,"Construction Companies, General Contractors",[],,
Construction,Giangeruso Construction,"747 Riverside Ave Apt C3 Lyndhurst, NJ 07071",,(201) 438-5075,Construction Companies,[],,
Construction,Affordable Construction,"78 W 25th St Bayonne, NJ 07002",,(201) 823-2713,Construction Companies,[],,
Construction,Long Construction,"21 Forrest Ct Woolwich Twp, NJ 08085",,(267) 270-5664,Construction Companies,[],,
Construction,RGD Construction,"5 Scott Dr Bayville, NJ 08721",,(732) 236-0244,Construction Companies,[],,
Construction,Bremman Construction,"919 State Route 33 Ste 23 Freehold, NJ 07728",,(732) 780-3348,"Visa Accepted, Construction Companies, Residential Construction, Mastercard Accepted, Roofing Contractors, Kitchen Remodeling, Deck Builders, Bathroom Remodeling, Home Remodeling Contractors, Patio Builders",[],Business Hours: Daily 8am-5pm,
Construction,Maio Construction,"135 Queen Anne Rd Bogota, NJ 07603",,(201) 820-0307,"Masonry, Construction Companies, Landscape Designers, Concrete Contractors, Paving Contractors, Home Improvement Stores, General Contractors, Landscaping, Other Nonresidential Construction, Construction & Remodeling, Fixtures",[],,
Construction,SJS Construction,"PO Box 125 Changewater, NJ 07831",,(908) 689-3072,Construction Companies,[],,
Construction,EMPA Construction,"38 Parker St # B Freehold, NJ 07728",,(732) 898-1033,"Construction Companies, General Contractors",[],,
Construction,Amb Construction,"30 Pekola Ter Carteret, NJ 07008",,(718) 449-6192,Construction Companies,[],Business Hours: Mon-Fri 8am-6pm,
Construction,Construction Bamrah,"33 Kane Ave Spotswood, NJ 08884",,(732) 251-2114,"General Contractors, Construction Companies",[],,
Construction,Construction Duppel,"3301 Tuckahoe Rd Franklinville, NJ 08322",,(856) 513-0926,"Construction Companies, General Contractors",[],,
Construction,Brich Construction,"119 Foothill Rd Flemington, NJ 08822",,(732) 992-8861,Construction Companies,[],,
Construction,Pyramid Construction,"84 Industrial Ave Little Ferry, NJ 07643",,(201) 641-0437,"General Contractors, Construction Companies",[],,
Construction,Vrh Construction,"344 Calvin Ct Wyckoff, NJ 07481",,(201) 891-7596,"General Contractors, Construction Management",[],,
Construction,Agate Construction,"1705 Bay Ave Point Pleasant Boro, NJ 08742",,(732) 202-7256,"Construction Management, Construction Companies",[],,
Construction,Oceanport Construction,"21 Main St Oceanport, NJ 07757",,(732) 542-7298,"City Legislators, Construction Companies, General Government Offices",[],,
Construction,Foresight Construction,"17 Central Ave West Orange, NJ 07052",,(862) 253-4408,Construction Companies,[],,
Construction,Mcnair Construction,"180 W Westfield Ave Roselle Park, NJ 07204",,(908) 445-4244,"General Contractors, Construction Companies",[],,
Construction,Gaudelli Construction,"131 Hogbin Rd Millville, NJ 08332",,(856) 825-1632,"Construction Companies, Government Contractors, General Contractors, Construction & Remodeling",[],,
Construction,Construction Office,"167 Main St Sayreville, NJ 08872",,(732) 390-7077,"General Government Offices, Construction Companies, City Legislators",[],,
Construction,ACC Construction,"445 Essex St Hackensack, NJ 07601",,(201) 546-7070,"Construction Management, Construction Companies, General Contractors",[],,
Construction,Oncenter Construction,"46 Newark Pompton Tpke Pequannock, NJ 07440",,(877) 266-7315,"Construction Companies, Home Remodeling Contractors, Masonry, Excavating Contractors, Install Retaining Walls, Construction Site Clean-Up, Construction & Remodeling, Demolition Contractors",[],Business Hours: Daily 7am-7pm,
Construction,Imc Construction,"536 Milltown Rd North Brunswick, NJ 08902",,(732) 246-3766,Construction Companies,[],,
Construction,Srm Construction,"1526 Brunswick Ave Lawrence Twp, NJ 08648",,(609) 278-9084,Construction Companies,[],,
Construction,Adam Construction,"18-23 Radburn Rd Fair Lawn, NJ 07410",,(201) 796-1545,"General Contractors, Construction Companies",[],,
Construction,Rockwood Construction,"1303 Lakeside Dr S Forked River, NJ 08731",,(609) 971-0630,Construction Companies,[],,
Construction,Kingsland Construction,"21 Davenport Ave Roseland, NJ 07068",,(973) 226-4189,Construction Companies,[],,
Construction,Lucas Construction,"173 Amboy Rd Morganville, NJ 07751",,(732) 955-8300,"Construction Companies, General Contractors, Government Contractors",[],,
Construction,Knight Construction,"173 Pinehurst Rd Brick, NJ 08723",,(732) 477-7730,Construction Companies,[],,
Construction,Renotec Construction,"6 Emmons Dr Millstone Twp, NJ 08510",,(732) 792-6910,"Construction Companies, General Contractors",[],,
Construction,Zid Construction,"28 Christina St Little Ferry, NJ 07643",,(201) 697-0710,Construction Companies,[],,
Construction,Re Construction,"55 Deckertown Tpke Montague, NJ 07827",,(973) 293-8793,Construction Companies,[],,
Construction,Stecher Construction,"322 Henry St Hammonton, NJ 08037",,(609) 567-1183,Construction Companies,[],,
Construction,EFG Construction,"37 Garden St Newark, NJ 07105",,(973) 344-5772,"General Contractors, Construction Companies",[],,
Construction,Isky Construction,"128 Joanne Ter Garfield, NJ 07026",,(973) 340-0888,Construction Companies,[],,
Construction,Dpa Construction,"137 Pecks Corner Cohansey Rd Bridgeton, NJ 08302",,(609) 743-0019,Construction Companies,[],,
Construction,Wohlsen Construction,"345 Eagle Rock Ave Roseland, NJ 07068",,(973) 521-7095,"General Contractors, Construction Companies",[],,
Construction,Daisy Construction,"514 Main St Bradley Beach, NJ 07720",,(732) 776-7302,Construction Companies,[],,
Construction,Vasili Construction,"155 Old Hoboken Rd Hackensack, NJ 07601",,(862) 668-4814,Construction Companies,[],,
Construction,Kutch Construction,"1037 Valley Rd Wayne, NJ 07470",,(973) 305-8709,"Ceramic Tile Contractors, Construction & Remodeling, Kitchen Remodeling, Bathroom Remodeling, Construction Companies, General Contractors, Home Remodeling Contractors, Tile Contractors, Floor Contractors",[],Business Hours: Mon-Sat 9am-5pm,
Construction,Sharpe Construction,"371 Railroad Ave West Creek, NJ 08092",,(609) 296-3509,Construction Companies,[],"Business Hours: Mon-Fri 9am-5pm, Sat 10am-4pm",
Construction,Sunray Construction,"910 Mansion Ave Haddon Township, NJ 08108",,(856) 425-0044,Construction Companies,[],,
Construction,Cnc Construction,"199 New Rd Parsippany, NJ 07054",,(973) 882-7830,"General Contractors, Government Contractors, Construction Companies",[],,
Construction,Quezada Construction,"504 Joralemon St Belleville, NJ 07109",,(973) 710-6100,"Storm Window & Door Manufacturers, Plumbing Contractors, Glass Doors, Doors, Wood Door Manufacturers, Shower Enclosure Manufacturers, Metal Door Manufacturers, Building Materials, Basement Remodeling, Electrical Contractors, Construction Companies, Paving Contractors, Kitchen Remodeling, Construction & Remodeling, Garage Doors, Floor Contractors, Other Nonresidential Construction",[],Business Hours: Mon - Sat 7:00 am - 5:00 pm,
Construction,Logan Construction,"120 Ocean Blvd Atlantic Hlds, NJ 07716",,(732) 671-1646,"Home Builders, General Contractors, Construction Companies",[],,
Construction,Grace Construction,"210 Lake Dr E Ste 100 Cherry Hill, NJ 08002",,(856) 755-0041,"Government Contractors, Concrete Contractors, Other Nonresidential Construction, Wholesale Concrete, General Contractors, Construction & Remodeling, Construction Companies, Construction Management, Concrete Products",[],Business Hours: Mon-Fri 8am-5pm,
Construction,Pmc Construction,"9 Prospect St Mendham, NJ 07945",,(973) 543-5429,Construction Companies,[],,
Construction,Goads Construction,"274 Easy St Howell, NJ 07731",,(732) 938-7664,"Construction Companies, Home Remodeling Contractors",[],Business Hours: Mon-Fri 7am-5pm,
Construction,Kingsway Construction,"PO Box 2273 Neptune, NJ 07754",,(732) 500-0660,Construction Companies,[],,
Construction,Wynmere Construction,"276 Glen Ave Dumont, NJ 07628",,(201) 384-3900,"General Contractors, Construction Companies",[],,
Construction,Pride Construction,"10 Centre Dr Monroe Twp, NJ 08831",,(609) 356-1111,"General Contractors, Construction Companies",[],,
Construction,Ahrens Construction,"755 US Highway 46 Parsippany, NJ 07054",,(973) 335-3330,"General Contractors, Construction & Remodeling, Construction Companies",[],,
Construction,Hermann Construction,"52 Taylor Ave Manasquan, NJ 08736",,(732) 974-3800,"Construction Companies, General Contractors",[],,
Construction,Lz Construction,"13 Mabie St Apt 3 Franklin, NJ 07416",,(973) 827-2799,Construction Companies,[],,
Construction,Golden Construction,"84 Columbia Ave Long Branch, NJ 07740",,(732) 222-0051,Construction Companies,[],,
Construction,Marco Construction,"75 Aycrigg Ave Passaic, NJ 07055",,(973) 773-7679,Construction Companies,[],,
Construction,Wohlsen Construction,"603 Mountain Ave New Providence, NJ 07974",,(908) 263-7128,"Dirt Contractors, Construction & Remodeling, Construction Companies",[],,
Construction,Riley Construction,"9 Dale Pl Neptune, NJ 07753",,(732) 618-9119,Construction Companies,[],,
